{"$schema":"https://json-schema.org/draft/2020-12/schema","additionalProperties":true,"properties":{"agent":{"additionalProperties":true,"properties":{"behavioral_contract":{"additionalProperties":true,"properties":{"error_model":{"additionalProperties":true,"properties":{"logging":{"type":"string"},"raises":{"items":{"type":"string"},"type":"array"},"retryable":{"items":{"type":"string"},"type":"array"}},"required":["raises","retryable","logging"],"type":"object"},"inputs":{"items":{"type":"string"},"type":"array"},"outputs":{"items":{"type":"string"},"type":"array"},"side_effects":{"items":{"type":"string"},"type":"array"}},"required":["inputs","outputs","side_effects","error_model"],"type":"object"},"dependencies":{"additionalProperties":true,"properties":{"depends_on_files":{"items":{"type":"string"},"type":"array"},"external_imports":{"items":{"type":"string"},"type":"array"},"internal_imports":{"items":{"type":"string"},"type":"array"},"runtime_couplings":{"items":{"type":"string"},"type":"array"}},"required":["internal_imports","external_imports","runtime_couplings","depends_on_files"],"type":"object"},"dependents":{"additionalProperties":true,"properties":{"notes":{"type":"string"},"used_by_dirs":{"items":{"type":"string"},"type":"array"},"used_by_files":{"items":{"type":"string"},"type":"array"}},"required":["used_by_files","used_by_dirs","notes"],"type":"object"},"examples":{"additionalProperties":true,"properties":{"integration_flow":{"items":{"type":"string"},"type":"array"},"usage_snippets":{"items":{"additionalProperties":true,"properties":{"code":{"type":"string"},"title":{"type":"string"}},"required":["title","code"],"type":"object"},"type":"array"}},"required":["usage_snippets","integration_flow"],"type":"object"},"lifecycle":{"additionalProperties":true,"properties":{"cleanup":{"additionalProperties":true,"properties":{"has_cleanup":{"type":"boolean"},"method_names":{"items":{"type":"string"},"type":"array"},"order_constraints":{"items":{"type":"string"},"type":"array"}},"required":["has_cleanup","method_names","order_constraints"],"type":"object"},"construction":{"type":"string"},"ownership":{"type":"string"},"threading":{"additionalProperties":true,"properties":{"async":{"type":"boolean"},"locks":{"items":{"type":"string"},"type":"array"},"thread_safe":{"type":"boolean"}},"required":["thread_safe","locks","async"],"type":"object"}},"required":["construction","ownership","cleanup","threading"],"type":"object"},"public_surface":{"additionalProperties":true,"properties":{"entrypoints":{"items":{"type":"string"},"type":"array"},"exports":{"items":{"type":"string"},"type":"array"},"interfaces":{"additionalProperties":true,"properties":{"abc":{"items":{"type":"string"},"type":"array"},"datamodels":{"items":{"type":"string"},"type":"array"},"protocols":{"items":{"type":"string"},"type":"array"}},"type":"object"}},"required":["exports","entrypoints","interfaces"],"type":"object"},"role_in_system":{"additionalProperties":true,"properties":{"invariants":{"items":{"type":"string"},"type":"array"},"layer":{"type":"string"},"non_goals":{"items":{"type":"string"},"type":"array"},"pitfalls":{"items":{"type":"string"},"type":"array"},"responsibilities":{"items":{"type":"string"},"type":"array"}},"required":["layer","responsibilities","non_goals","invariants","pitfalls"],"type":"object"},"summary":{"additionalProperties":true,"properties":{"detail":{"type":"string"},"one_liner":{"type":"string"}},"required":["one_liner","detail"],"type":"object"},"testing":{"additionalProperties":true,"properties":{"commands":{"items":{"type":"string"},"type":"array"},"coverage_expectations":{"items":{"type":"string"},"type":"array"},"fixtures":{"items":{"type":"string"},"type":"array"},"mocks":{"items":{"type":"string"},"type":"array"},"test_types":{"items":{"type":"string"},"type":"array"}},"required":["test_types","commands","mocks","fixtures","coverage_expectations"],"type":"object"}},"required":["summary","role_in_system","public_surface","behavioral_contract","dependencies","dependents","lifecycle","testing","examples"],"type":"object"},"computed":{"additionalProperties":true,"properties":{"checksums":{"additionalProperties":true,"properties":{"analyzer_version":{"type":["string","null"]},"code_hash_sha256":{"type":["string","null"]},"ctx_semantic_hash_sha256":{"type":["string","null"]},"template_version":{"type":["string","null"]}},"required":["code_hash_sha256","ctx_semantic_hash_sha256","template_version","analyzer_version"],"type":"object"},"facts":{"additionalProperties":true,"type":"object"},"freshness_state":{"enum":["missing","stale","fresh","needs_review","blocked"]},"last_scan":{"additionalProperties":true,"properties":{"scan_id":{"type":["string","null"]},"scanned_at":{"type":["string","null"]}},"type":"object"},"review":{"additionalProperties":true,"properties":{"last_review_scan_id":{"type":["string","null"]},"review_every_n_scans":{"minimum":0,"type":"integer"},"scan_counter":{"minimum":0,"type":"integer"}},"type":"object"},"staleness_reasons":{"items":{"type":"string"},"type":"array"}},"required":["freshness_state","staleness_reasons","checksums"],"type":"object"},"identity":{"additionalProperties":true,"properties":{"ctx_path":{"type":"string"},"language":{"type":"string"},"module":{"type":["string","null"]},"path":{"type":"string"}},"required":["path","ctx_path","language"],"type":"object"},"kind":{"const":"file_ctx"},"schema_version":{"minimum":1,"type":"integer"}},"required":["kind","schema_version","identity","agent","computed"],"title":"file_ctx","type":"object"}