{"agent":{"behavioral_contract":{"error_model":{"logging":"Does not log; relies on upstream validation and Cleanable checks.","raises":["RuntimeError if used after cleanup via Cleanable.check_cleaned","ValueError for missing dependency graph or dependencies"],"retryable":[]},"inputs":["spell: Any","spell_index: SpellIndex","spellframe: Any | None","binding_name: str | None","spell_name: str","existence: Existence","spell_type: SpellType","spell_id: str","permissions: Permissions","aetheric_frame: str","profile: Any | None","existing_object: object | None","spellbook: ISpellbook | None","dag: Any","dependencies: list[str]","conduit_id: str","cancel_event: CancellationEvent | None","override: dict | None"],"outputs":["Spell","bool","tuple[str | None, str | None]","SpellSystemState | None"],"side_effects":["Creates SpellCrafter and resolution phase artifacts","Updates mutation override and marks structural change","Cleans and releases spell resources on cleanup"]},"dependencies":{"depends_on_files":["src/melder/__melder_registration_guard__.py","src/melder/aether/dev_ops/spell_system_states/spell_state_change_reason.py","src/melder/spellbook/spell_crafter/spell_examiner/profiles/resolution_profile.py","src/melder/utilities/general_base/cleanable.py","src/melder/utilities/helpers/general_helpers.py","src/melder/utilities/interfaces/interfaces.py","src/melder/spellbook/spell_types/spell_types.py","src/melder/spellbook/existence/existence.py","src/melder/aether/conduit/conduit_ward/permissions/permissions.py","src/melder/spellbook/bind/spell_index.py","src/melder/utilities/synchronization/cancellation_event_signal.py"],"external_imports":["typing","ulid","threading"],"internal_imports":["melder.__melder_registration_guard__","melder.aether.dev_ops.spell_system_states.spell_state_change_reason","melder.spellbook.spell_crafter.spell_examiner.profiles.resolution_profile","melder.utilities.general_base.cleanable","melder.utilities.helpers.general_helpers","melder.utilities.interfaces.interfaces","melder.spellbook.spell_types.spell_types","melder.spellbook.existence.existence","melder.aether.conduit.conduit_ward.permissions.permissions","melder.spellbook.bind.spell_index","melder.utilities.synchronization.cancellation_event_signal"],"runtime_couplings":["Integrates with SpellCrafter for phase artifacts","Uses SpellSystemStates to mark structural changes"]},"dependents":{"notes":"Core spell record owned by Spellbook and used by Conduit resolution.","used_by_dirs":["src/melder/spellbook/**","src/melder/aether/**"],"used_by_files":[]},"examples":{"integration_flow":["Bind a spell to create a Spell record","Run structural or full phases via SpellCrafter facades","Apply mutation overrides when needed"],"usage_snippets":[{"code":"spell.run_structural_phases()","title":"Run structural phases"}]},"lifecycle":{"cleanup":{"has_cleanup":true,"method_names":["cleanup"],"order_constraints":["Cleanup phase artifacts before clearing references"]},"construction":"Initializes spell metadata, hooks, and keying data under a lock.","ownership":"Owns spell metadata, hooks, and phase artifacts via SpellCrafter.","threading":{"async":false,"locks":["Spell._lock"],"thread_safe":true}},"public_surface":{"entrypoints":["Spell.cleanup","Spell.__enter__","Spell.__exit__","Spell.__repr__","Spell.key","Spell.is_existing_creation","Spell.is_class_spell","Spell.is_method_spell","Spell.is_lambda_spell","Spell.has_existing_object","Spell.owner_conduit_info","Spell.requirements","Spell.symbolic_graph","Spell.resolution_frame","Spell.validation_result_phase4","Spell.validation_result_phase6","Spell.validated","Spell.is_broken","Spell.run_phase_requirements","Spell.run_phase_symbolic_graph","Spell.run_phase_local_frame","Spell.run_phase_validation","Spell.run_phase_root_blueprints","Spell.run_phase_system_validation","Spell.run_phase_change_control","Spell.run_structural_phases","Spell.run_all_phases","Spell.system_state","Spell.mutation_override","Spell.has_mutation_override","Spell.apply_mutation_override","Spell.clear_mutation_override"],"exports":["Spell"],"interfaces":{"abc":[],"datamodels":[],"protocols":["ISpell"]}},"role_in_system":{"invariants":["Spell_id and SpellIndex identify lineage and version","Resolution phases are executed via SpellCrafter"],"layer":"core","non_goals":["Does not resolve dependencies directly","Does not enforce permissions itself"],"pitfalls":["Using the spell after cleanup","Mutating metadata without holding the lock"],"responsibilities":["Hold spell metadata and hooks","Expose phase execution facades","Manage mutation overlay state"]},"summary":{"detail":"Core spell record containing identity, metadata, hooks, and facades for resolution phases and mutation overlays.","one_liner":"Represents a bound spell with metadata and phase facades."},"testing":{"commands":[],"coverage_expectations":["phase facade sequencing","cleanup clears artifacts and metadata","mutation override updates change reason"],"fixtures":[],"mocks":[],"test_types":[]}},"computed":{"checksums":{"analyzer_version":null,"code_hash_sha256":null,"ctx_semantic_hash_sha256":null,"template_version":"file_ctx@v1"},"freshness_state":"fresh","staleness_reasons":[]},"identity":{"ctx_path":"src/melder/spellbook/__spell__.json","language":"python","module":"melder.spellbook.spell","path":"src/melder/spellbook/spell.py"},"kind":"file_ctx","schema_version":1}