{"agent":{"behavioral_contract":{"error_model":{"logging":"None; raises for missing root spell.","raises":["ValueError when root_spell is None"],"retryable":[]},"inputs":["root_spell: ISpell","overrides: mapping | None","cancel_event: CancellationEvent | None","logger: Any | None","caller_creations: Any | None","caller_creations_lock_held: bool"],"outputs":["MeldContext"],"side_effects":["Normalizes overrides and logger; stores per-call metadata"]},"dependencies":{"depends_on_files":["src/melder/utilities/general_base/cleanable.py","src/melder/utilities/helpers/init_helpers.py","src/melder/utilities/logger/safe_logger.py","src/melder/utilities/synchronization/cancellation_event_signal.py","src/melder/utilities/interfaces/interfaces.py","src/melder/__melder_registration_guard__.py"],"external_imports":["threading","typing"],"internal_imports":["melder.utilities.general_base.cleanable","melder.utilities.helpers.init_helpers","melder.utilities.logger.safe_logger","melder.utilities.synchronization.cancellation_event_signal","melder.utilities.interfaces.interfaces","melder.__melder_registration_guard__"],"runtime_couplings":["Uses InitHelpers.resolve_safe_logger for optional logging"]},"dependents":{"notes":"Constructed per meld call and consumed by MeldRuntime/MeldEngine.","used_by_dirs":["src/melder/aether/conduit/meld/**"],"used_by_files":[]},"examples":{"integration_flow":["Build context for a meld call","Pass context into MeldRuntime","Cleanup after execution"],"usage_snippets":[{"code":"ctx = MeldContext(root_spell=spell, overrides={'x': 1})","title":"Create a meld context"}]},"lifecycle":{"cleanup":{"has_cleanup":true,"method_names":["cleanup"],"order_constraints":["Drop references after execution"]},"construction":"Captures per-call spell, creations scopes, overrides, and optional cancellation/logger metadata.","ownership":"Owns per-call context state for meld execution.","threading":{"async":false,"locks":["MeldContext._lock"],"thread_safe":true}},"public_surface":{"entrypoints":["MeldContext.root_spell","MeldContext.creations","MeldContext.overrides","MeldContext.cleanup"],"exports":["MeldContext"],"interfaces":{"abc":[],"datamodels":[],"protocols":[]}},"role_in_system":{"invariants":["One context per meld call","Owner/Caller creations are tracked explicitly"],"layer":"core","non_goals":["No DI execution"],"pitfalls":["Reusing context across calls"],"responsibilities":["Carry per-call data into the meld runtime","Provide normalized overrides and cancellation metadata"]},"summary":{"detail":"Per-call container for meld execution, capturing root spell, creations scopes, overrides, cancellation, and logging metadata.","one_liner":"Per-call context for meld execution."},"testing":{"commands":[],"coverage_expectations":["cleanup clears references","root_spell is required"],"fixtures":[],"mocks":[],"test_types":[]}},"computed":{"checksums":{"analyzer_version":null,"code_hash_sha256":null,"ctx_semantic_hash_sha256":null,"template_version":"file_ctx@v1"},"freshness_state":"fresh","staleness_reasons":[]},"identity":{"ctx_path":"src/melder/aether/conduit/meld/meld_context/__meld_context__.json","language":"python","module":"melder.aether.conduit.meld.meld_context.meld_context","path":"src/melder/aether/conduit/meld/meld_context/meld_context.py"},"kind":"file_ctx","schema_version":1}