{"agent":{"behavioral_contract":{"error_model":{"logging":"Does not log; uses validation exceptions for missing inputs.","raises":["ValueError for missing frame, spell_index, spell, or topology","RuntimeError if used after cleanup via Cleanable.check_cleaned"],"retryable":[]},"inputs":["frame: AethericFrame","spell_index: ISpellIndex","spell: ISpell","dependency_ids: Iterable[str]","reason: SpellStateChangeReason","root_index_ids: Iterable[str]","conduit_id: str","spell_id: str","root_id: str","validity: SpellValidity","validity_map: Mapping[str, SpellValidity]","diagnostics: Sequence[SystemDiagnostic]","topology: SpellLocalTopology"],"outputs":["SpellSystemState","list[str]","set[str]","ConduitResolutionState"],"side_effects":["Registers and updates lineage state registries","Tracks dirty lineages and impact closures","Manages per-conduit resolution validity and diagnostics"]},"dependencies":{"depends_on_files":["src/melder/__melder_registration_guard__.py","src/melder/aether/dev_ops/spell_system_states/conduit_resolution_state.py","src/melder/aether/dev_ops/spell_system_states/spell_state_change_reason.py","src/melder/aether/dev_ops/spell_system_states/spell_system_state.py","src/melder/aether/dev_ops/spell_system_states/spell_validity.py","src/melder/spellbook/bind/spell_index.py","src/melder/spellbook/spell_crafter/system/system_diagnostic.py","src/melder/utilities/general_base/cleanable.py","src/melder/utilities/interfaces/interfaces.py"],"external_imports":["threading","typing"],"internal_imports":["melder.__melder_registration_guard__","melder.aether.dev_ops.spell_system_states.conduit_resolution_state","melder.aether.dev_ops.spell_system_states.spell_state_change_reason","melder.aether.dev_ops.spell_system_states.spell_system_state","melder.aether.dev_ops.spell_system_states.spell_validity","melder.spellbook.bind.spell_index","melder.spellbook.spell_crafter.system.system_diagnostic","melder.utilities.general_base.cleanable","melder.utilities.interfaces.interfaces"],"runtime_couplings":["Owns SpellSystemState and ConduitResolutionState instances","Receives topology and lineage updates from Spellbook/SpellCrafter"]},"dependents":{"notes":"Central registry consumed by DevOpsManager and validation flows.","used_by_dirs":["src/melder/aether/dev_ops/**"],"used_by_files":[]},"examples":{"integration_flow":["Register lineages as spells are bound","Update dependencies and compute impact closure","Consume dirty lineages for validation","Track per-conduit resolution validity"],"usage_snippets":[{"code":"state = system_states.register_lineage(spell_index, spell)","title":"Register a lineage"}]},"lifecycle":{"cleanup":{"has_cleanup":true,"method_names":["cleanup"],"order_constraints":["Cleanup child states before clearing indexes"]},"construction":"Initializes state registries and dirty lineage tracking.","ownership":"Owns SpellSystemState, ConduitResolutionState, and local topology records.","threading":{"async":false,"locks":["SpellSystemStates._lock"],"thread_safe":true}},"public_surface":{"entrypoints":["SpellSystemStates.register_lineage","SpellSystemStates.get_by_index_id","SpellSystemStates.get_by_spell_id","SpellSystemStates.update_dependencies","SpellSystemStates.mark_structural_change","SpellSystemStates.compute_impact_closure","SpellSystemStates.consume_dirty_lineages","SpellSystemStates.iter_states","SpellSystemStates.get_conduit_resolution_state","SpellSystemStates.get_or_create_conduit_resolution_state","SpellSystemStates.drop_conduit_resolution_state","SpellSystemStates.iter_conduit_resolution_states","SpellSystemStates.set_conduit_spell_validity","SpellSystemStates.bulk_set_conduit_spell_validity","SpellSystemStates.set_conduit_root_validity","SpellSystemStates.bulk_set_conduit_root_validity","SpellSystemStates.record_conduit_diagnostics","SpellSystemStates.clear_conduit_diagnostics","SpellSystemStates.mark_conduit_dirty","SpellSystemStates.clear_conduit_dirty","SpellSystemStates.register_local_topology","SpellSystemStates.get_local_topology","SpellSystemStates.get_local_topology_by_id","SpellSystemStates.cleanup"],"exports":["SpellSystemStates"],"interfaces":{"abc":[],"datamodels":[],"protocols":["ISpellSystemStates"]}},"role_in_system":{"invariants":["Dirty lineages are tracked and consumed through a lock","Per-conduit resolution state is keyed by conduit_id"],"layer":"service","non_goals":["Does not enforce validation policy","Does not persist state across runs"],"pitfalls":["Registering lineages without updating dependencies","Calling after cleanup"],"responsibilities":["Maintain lineage state registry","Track dirty lineages and impact closure","Expose per-conduit resolution validity management"]},"summary":{"detail":"Per-frame registry managing spell lineage state, dirty tracking, and per-conduit resolution validity.","one_liner":"Central registry for spell system state and dirty tracking."},"testing":{"commands":[],"coverage_expectations":["lineage registration and lookup","dependency updates and impact closure","per-conduit resolution state lifecycle"],"fixtures":[],"mocks":[],"test_types":[]}},"computed":{"checksums":{"analyzer_version":null,"code_hash_sha256":null,"ctx_semantic_hash_sha256":null,"template_version":"file_ctx@v1"},"freshness_state":"fresh","staleness_reasons":[]},"identity":{"ctx_path":"src/melder/aether/dev_ops/spell_system_states/__spell_system_states__.json","language":"python","module":"melder.aether.dev_ops.spell_system_states.spell_system_states","path":"src/melder/aether/dev_ops/spell_system_states/spell_system_states.py"},"kind":"file_ctx","schema_version":1}