{"agent":{"behavioral_contract":{"error_model":{"logging":"None; enum values are static.","raises":[],"retryable":[]},"inputs":[],"outputs":["ContractTypes"],"side_effects":[]},"dependencies":{"depends_on_files":["src/melder/__melder_registration_guard__.py"],"external_imports":["enum"],"internal_imports":["melder.__melder_registration_guard__"],"runtime_couplings":[]},"dependents":{"notes":"Used in contract Detail entries to identify initiated vs received grants.","used_by_dirs":["src/melder/aether/conduit/conduit_ward/**"],"used_by_files":[]},"examples":{"integration_flow":["Tag a Detail as initiated or received"],"usage_snippets":[{"code":"ctype = ContractTypes.initiated","title":"Choose a contract type"}]},"lifecycle":{"cleanup":{"has_cleanup":false,"method_names":[],"order_constraints":[]},"construction":"Enum values are declared at import time.","ownership":"Owns only enum members.","threading":{"async":false,"locks":[],"thread_safe":true}},"public_surface":{"entrypoints":["ContractTypes.initiated","ContractTypes.received"],"exports":["ContractTypes"],"interfaces":{"abc":[],"datamodels":[],"protocols":[]}},"role_in_system":{"invariants":["Enum values are stable"],"layer":"core","non_goals":["No runtime logic"],"pitfalls":["Using the wrong contract direction"],"responsibilities":["Identify contract direction for detail entries"]},"summary":{"detail":"Enum describing whether a contract detail was initiated or received from a ward's perspective.","one_liner":"Direction tags for contract details."},"testing":{"commands":[],"coverage_expectations":[],"fixtures":[],"mocks":[],"test_types":[]}},"computed":{"checksums":{"analyzer_version":null,"code_hash_sha256":null,"ctx_semantic_hash_sha256":null,"template_version":"file_ctx@v1"},"freshness_state":"fresh","staleness_reasons":[]},"identity":{"ctx_path":"src/melder/aether/conduit/conduit_ward/contract/contract_types/__contract_types__.json","language":"python","module":"melder.aether.conduit.conduit_ward.contract.contract_types.contract_types","path":"src/melder/aether/conduit/conduit_ward/contract/contract_types/contract_types.py"},"kind":"file_ctx","schema_version":1}