{"agent":{"behavioral_contract":{"error_model":{"logging":"Best-effort; records incidents via IncidentManager on failures.","raises":["RuntimeError when dynamic mode or ownership invariants fail","Exception re-raised after rollback on transfer failure"],"retryable":[]},"inputs":["source_conduit: Any","target_conduit: Any","spell: Spell | str | SpellIndex","move_creations: bool","include_dependencies: bool","force_unshare: bool","invalidate_after_transfer: bool","mark_dependencies_dirty: bool"],"outputs":["preflight -> dict","execute -> None"],"side_effects":["Flips spell ownership between conduits","Moves or tears down creations","Edits contracts and cluster shares","Marks lineages disabled/dirty","Records change-control entries and incidents"]},"dependencies":{"depends_on_files":["src/melder/aether/conduit/conduit_ward/permissions/permissions.py","src/melder/aether/conduit/conduit_ward/policies/policies.py","src/melder/utilities/synchronization/safeguard.py","src/melder/aether/conduit/conduit_ward/contract/detail_reason.py","src/melder/spellbook/bind/spell_index.py","src/melder/aether/dev_ops/spell_system_states/spell_state_change_reason.py","src/melder/aether/dev_ops/spell_system_states/spell_state.py","src/melder/aether/dev_ops/spell_system_states/spell_validity.py","src/melder/aether/dev_ops/incident_manager/incident_severity.py","src/melder/__melder_registration_guard__.py"],"external_imports":["ulid","typing"],"internal_imports":["melder.aether.conduit.conduit_ward.permissions.permissions","melder.aether.conduit.conduit_ward.policies.policies","melder.utilities.synchronization.safeguard","melder.aether.conduit.conduit_ward.contract.detail_reason","melder.spellbook.bind.spell_index","melder.aether.dev_ops.spell_system_states.spell_state_change_reason","melder.aether.dev_ops.spell_system_states.spell_state","melder.aether.dev_ops.spell_system_states.spell_validity","melder.aether.dev_ops.incident_manager.incident_severity","melder.__melder_registration_guard__"],"runtime_couplings":["Relies on conduit spellbook and Aether registries","Uses SafeGuard for atomic registry flips","Integrates with DevOps change-control and incident managers"]},"dependents":{"notes":"Invoked by conduit ward transfer APIs to move spell ownership between conduits.","used_by_dirs":["src/melder/aether/**"],"used_by_files":[]},"examples":{"integration_flow":["Preflight to gather affected borrowers/dependencies","Execute transfer to flip ownership and handle contracts","Mark lineage dirty and record incidents on failure"],"usage_snippets":[{"code":"transfer = TransferOfOwnership(source_conduit=src, target_conduit=tgt, spell=spell_id)\ntransfer.preflight()\ntransfer.execute()","title":"Transfer spell ownership"}]},"lifecycle":{"cleanup":{"has_cleanup":false,"method_names":[],"order_constraints":[]},"construction":"Initializes transfer options and caches change-control/incident managers.","ownership":"Owns transfer operation state and rollback actions.","threading":{"async":false,"locks":[],"thread_safe":false}},"public_surface":{"entrypoints":["TransferOfOwnership.preflight","TransferOfOwnership.execute"],"exports":["TransferOfOwnership"],"interfaces":{"abc":[],"datamodels":[],"protocols":[]}},"role_in_system":{"invariants":["Transfers require dynamic mode on both conduits","Ownership must originate from the source conduit"],"layer":"core","non_goals":["No direct UI or persistence"],"pitfalls":["Running without preflight snapshot","Transferring when dependencies are unresolved"],"responsibilities":["Coordinate spell ownership transfer","Handle contracts, clusters, and creations","Record change-control intent and incidents"]},"summary":{"detail":"Internal helper that transfers spell ownership between conduits, handling registry flips, contracts, creations, and DevOps state updates.","one_liner":"Transfers spell ownership between conduits with rollback support."},"testing":{"commands":[],"coverage_expectations":["Preflight summary includes borrowers and dependencies","Execute flips registry and spellbooks","Rollback restores prior state on failure"],"fixtures":[],"mocks":[],"test_types":[]}},"computed":{"checksums":{"analyzer_version":null,"code_hash_sha256":null,"ctx_semantic_hash_sha256":null,"template_version":"file_ctx@v1"},"freshness_state":"fresh","staleness_reasons":[]},"identity":{"ctx_path":"src/melder/aether/conduit/conduit_ward/transfer/__transfer_of_ownership__.json","language":"python","module":"melder.aether.conduit.conduit_ward.transfer.transfer_of_ownership","path":"src/melder/aether/conduit/conduit_ward/transfer/transfer_of_ownership.py"},"kind":"file_ctx","schema_version":1}