{"agent":{"behavioral_contract":{"error_model":{"logging":"Logs cleanup errors and raises ExceptionGroup when disposal fails.","raises":["RuntimeError when initialized for non-normal conduits","ValueError on duplicate keys","ExceptionGroup when cleanup/disposal errors occur"],"retryable":[]},"inputs":["disposal_enabled: bool","disposal_method_names: list[str]","conduit: IConduit","spell_id: str","item: object"],"outputs":["Creation","list[dict] (extract_spell_creations)","None for mutators"],"side_effects":["Tracks created instances across existence scopes","Attempts disposal via configured method names","Raises ExceptionGroup on cleanup failures"]},"dependencies":{"depends_on_files":["src/melder/utilities/general_base/cleanable.py","src/melder/utilities/interfaces/interfaces.py","src/melder/aether/conduit/creations/creation.py","src/melder/__melder_registration_guard__.py"],"external_imports":["threading","typing"],"internal_imports":["melder.utilities.general_base.cleanable","melder.utilities.interfaces.interfaces","melder.aether.conduit.creations.creation","melder.__melder_registration_guard__"],"runtime_couplings":["Uses conduit logger for cleanup reporting","Wraps instances in Creation wrappers"]},"dependents":{"notes":"Used by Conduit to manage normal-scope instance lifecycles.","used_by_dirs":["src/melder/aether/**"],"used_by_files":[]},"examples":{"integration_flow":["Add instances under existence scopes","Cleanup disposes instances via configured methods","Extract/restore creations during ownership transfer"],"usage_snippets":[{"code":"creations.add_unique(spell_id, instance)\ncreations.cleanup()","title":"Manage unique creation"}]},"lifecycle":{"cleanup":{"has_cleanup":true,"method_names":["cleanup"],"order_constraints":["Dispose instances before nulling registries"]},"construction":"Initializes per-scope registries and disposal configuration for a normal conduit.","ownership":"Owns Creation wrappers and disposal behavior for a conduit.","threading":{"async":false,"locks":["Creations._lock"],"thread_safe":true}},"public_surface":{"entrypoints":["Creations.add_unique","Creations.add_unique_per_scope","Creations.add_unique_per_lineage","Creations.add_unique_per_cluster","Creations.add_many","Creations.extract_spell_creations","Creations.restore_spell_creations","Creations.register_spellspace_creation","Creations.clear_spellspace_instances","Creations.cleanup"],"exports":["Creations"],"interfaces":{"abc":[],"datamodels":[],"protocols":["ICreations"]}},"role_in_system":{"invariants":["Only normal conduits may own Creations"],"layer":"core","non_goals":["No spell resolution logic"],"pitfalls":["Duplicate spell ids across scopes","Disposal methods missing on instances"],"responsibilities":["Track instances by existence scope","Dispose instances during cleanup","Support extraction/restoration for transfers"]},"summary":{"detail":"Normal-scope instance manager that tracks creations by existence scope, disposes them on cleanup, and supports extraction/restoration for transfers.","one_liner":"Manages creation lifecycles for normal conduits."},"testing":{"commands":[],"coverage_expectations":["Cleanup disposes all scopes","Extract/restore preserves creations"],"fixtures":[],"mocks":[],"test_types":[]}},"computed":{"checksums":{"analyzer_version":null,"code_hash_sha256":null,"ctx_semantic_hash_sha256":null,"template_version":"file_ctx@v1"},"freshness_state":"fresh","staleness_reasons":[]},"identity":{"ctx_path":"src/melder/aether/conduit/creations/__creations__.json","language":"python","module":"melder.aether.conduit.creations.creations","path":"src/melder/aether/conduit/creations/creations.py"},"kind":"file_ctx","schema_version":1}