{"agent":{"behavioral_contract":{"error_model":{"logging":"Does not log; relies on exceptions for invalid configuration operations.","raises":["RuntimeError for modifications after freeze or cleanup","TypeError for invalid property or hook types","ValueError for invalid enum values or missing required properties"],"retryable":[]},"inputs":["aether_frame: str","key: str","value: Any","factory: Callable[[object], Any]","hook_name: str","hook: Callable[..., Any]","spellbook_id: str"],"outputs":["Any (property values)","bool","dict[str, list[Callable[..., Any]]]","IConfiguration (fluent returns)"],"side_effects":["Stores configuration properties and hook registries","Freezes configuration to prevent further mutation","Constructs and uses logger factory wrappers"]},"dependencies":{"depends_on_files":["src/melder/__melder_registration_guard__.py","src/melder/spellbook/configuration/system_state.py","src/melder/utilities/general_base/cleanable.py","src/melder/utilities/helpers/general_helpers.py","src/melder/utilities/interfaces/interfaces.py","src/melder/utilities/helpers/package.py","src/melder/utilities/logger/std_logger_factory.py"],"external_imports":["threading","enum","typing","ulid"],"internal_imports":["melder.__melder_registration_guard__","melder.spellbook.configuration.system_state","melder.utilities.general_base.cleanable","melder.utilities.helpers.general_helpers","melder.utilities.interfaces.interfaces","melder.utilities.helpers.package","melder.utilities.logger.std_logger_factory"],"runtime_couplings":["Uses SystemState enum for system mode","Uses Pack wrapper for logger factory management"]},"dependents":{"notes":"Core configuration object used by Conduit, Spellbook, and Meld subsystems.","used_by_dirs":["src/melder/spellbook/**","src/melder/aether/**"],"used_by_files":[]},"examples":{"integration_flow":["Set defaults and required properties","Register hooks and logger factory","Freeze configuration before use"],"usage_snippets":[{"code":"cfg = Configuration().with_defaults().with_system_state('automatic').finalize()","title":"Configure and freeze"}]},"lifecycle":{"cleanup":{"has_cleanup":true,"method_names":["cleanup"],"order_constraints":["Clear hooks and properties before dropping logger factory"]},"construction":"Initializes property registry, hook registry, and logger factory state.","ownership":"Owns configuration properties, hook registry, and logger factory wrapper.","threading":{"async":false,"locks":["Configuration._lock"],"thread_safe":true}},"public_surface":{"entrypoints":["Configuration.set_property","Configuration.clear_properties","Configuration.set_logger_factory","Configuration.get_logger_for","Configuration.freeze","Configuration.validate","Configuration.validate_enums","Configuration.get_property","Configuration.has_property","Configuration.load_default_dictionary","Configuration.has_logger_factory","Configuration.add_hook","Configuration.add_hooks","Configuration.get_hooks","Configuration.with_phase_scheduler_workers","Configuration.with_phase_scheduler_barrier_timeout","Configuration.with_ai_native","Configuration.with_hook","Configuration.with_hooks","Configuration.clear_logger_factory","Configuration.with_logger_factory","Configuration.with_defaults","Configuration.with_system_state","Configuration.with_debugging","Configuration.with_disposal","Configuration.with_disposal_method_names","Configuration.add_disposal_methods","Configuration.finalize","Configuration.build","Configuration.dynamic_defaults","Configuration.automatic_defaults","Configuration.cleanup"],"exports":["Configuration"],"interfaces":{"abc":[],"datamodels":[],"protocols":["IConfiguration"]}},"role_in_system":{"invariants":["Idempotent properties can only be set once","Freeze prevents further modifications"],"layer":"core","non_goals":["Does not persist configuration to disk","Does not manage runtime logging behavior itself"],"pitfalls":["Attempting to modify after freeze","Missing required properties before validation"],"responsibilities":["Store and validate configuration properties","Manage system hook registrations","Provide fluent configuration builders"]},"summary":{"detail":"Central configuration manager that stores system properties, hooks, and logger factories with validation and freeze semantics.","one_liner":"Manages global configuration, hooks, and validation."},"testing":{"commands":[],"coverage_expectations":["freeze prevents mutations","validation checks required properties and types","hook registration and retrieval"],"fixtures":[],"mocks":[],"test_types":[]}},"computed":{"checksums":{"analyzer_version":null,"code_hash_sha256":null,"ctx_semantic_hash_sha256":null,"template_version":"file_ctx@v1"},"freshness_state":"fresh","staleness_reasons":[]},"identity":{"ctx_path":"src/melder/spellbook/configuration/__configuration__.json","language":"python","module":"melder.spellbook.configuration.configuration","path":"src/melder/spellbook/configuration/configuration.py"},"kind":"file_ctx","schema_version":1}