{"agent":{"behavioral_contract":{"error_model":{"logging":"Does not log; enum provides constant values.","raises":[],"retryable":[]},"inputs":[],"outputs":["SystemState enum values"],"side_effects":[]},"dependencies":{"depends_on_files":["src/melder/__melder_registration_guard__.py"],"external_imports":["enum"],"internal_imports":["melder.__melder_registration_guard__"],"runtime_couplings":[]},"dependents":{"notes":"Used by Configuration to control system mode.","used_by_dirs":["src/melder/spellbook/**"],"used_by_files":[]},"examples":{"integration_flow":["Set system_state in Configuration"],"usage_snippets":[{"code":"state = SystemState.dynamic","title":"Set dynamic mode"}]},"lifecycle":{"cleanup":{"has_cleanup":false,"method_names":[],"order_constraints":[]},"construction":"Enum values are defined at import time.","ownership":"No owned resources.","threading":{"async":false,"locks":[],"thread_safe":true}},"public_surface":{"entrypoints":["SystemState.automatic","SystemState.dynamic"],"exports":["SystemState"],"interfaces":{"abc":[],"datamodels":[],"protocols":[]}},"role_in_system":{"invariants":["Enum values are stable"],"layer":"support","non_goals":["Does not enforce runtime policy"],"pitfalls":["Switching modes without updating dependent configuration"],"responsibilities":["Define global system mode for configuration"]},"summary":{"detail":"Enum representing global system mode (automatic or dynamic).","one_liner":"System operating modes."},"testing":{"commands":[],"coverage_expectations":["Enum values exist and are distinct"],"fixtures":[],"mocks":[],"test_types":[]}},"computed":{"checksums":{"analyzer_version":null,"code_hash_sha256":null,"ctx_semantic_hash_sha256":null,"template_version":"file_ctx@v1"},"freshness_state":"fresh","staleness_reasons":[]},"identity":{"ctx_path":"src/melder/spellbook/configuration/__system_state__.json","language":"python","module":"melder.spellbook.configuration.system_state","path":"src/melder/spellbook/configuration/system_state.py"},"kind":"file_ctx","schema_version":1}