{"agent":{"behavioral_contract":{"error_model":{"logging":"None; module defines a constant only.","raises":[],"retryable":[]},"inputs":[],"outputs":["__description__: str"],"side_effects":[]},"dependencies":{"depends_on_files":[],"external_imports":[],"internal_imports":[],"runtime_couplings":[]},"dependents":{"notes":"Metadata module; consumers import the description as needed.","used_by_dirs":[],"used_by_files":[]},"examples":{"integration_flow":["Import __description__ from melder.__description__","Expose the description in package metadata"],"usage_snippets":[{"code":"from melder.__description__ import __description__\nprint(__description__)","title":"Read package description"}]},"lifecycle":{"cleanup":{"has_cleanup":false,"method_names":[],"order_constraints":[]},"construction":"Constant is assigned at module import.","ownership":"Owns no resources.","threading":{"async":false,"locks":[],"thread_safe":true}},"public_surface":{"entrypoints":["__description__"],"exports":["__description__"],"interfaces":{"abc":[],"datamodels":[],"protocols":[]}},"role_in_system":{"invariants":["Description string remains stable at import time"],"layer":"metadata","non_goals":["No runtime behavior","No IO or configuration management"],"pitfalls":["Treating description as runtime configuration"],"responsibilities":["Expose package description constant","Provide a human-readable description for metadata displays"]},"summary":{"detail":"Provides the package description string for Melder metadata consumers.","one_liner":"Defines the package description constant."},"testing":{"commands":[],"coverage_expectations":[],"fixtures":[],"mocks":[],"test_types":[]}},"computed":{"checksums":{"analyzer_version":null,"code_hash_sha256":null,"ctx_semantic_hash_sha256":null,"template_version":"file_ctx@v1"},"freshness_state":"fresh","staleness_reasons":[]},"identity":{"ctx_path":"src/melder/____description____.json","language":"python","module":"melder.__description__","path":"src/melder/__description__.py"},"kind":"file_ctx","schema_version":1}