{"agent":{"behavioral_contract":{"error_model":{"logging":"Logs errors via SafeLogger when cleanup or management operations fail.","raises":["RuntimeError when default frame is unavailable","ValueError when frames, conduits, clusters, or spells are missing or invalid","TypeError for invalid argument types"],"retryable":[]},"inputs":["logger: Any | None","aetheric_frame_name: str","configuration: IConfiguration","conduit: IConduit","conduit_id: str","cluster_name: str","spell_id: str","spell_index: SpellIndex","spell_set: Set[SpellIndex]","cancel_event: Any"],"outputs":["AethericFrame","IConduitCloud","IConduit","SpellIndex | None","set[str]","DevOpsManager / SpellSystemStates / IncidentManager / ChangeControlManager","None for mutating operations"],"side_effects":["Creates and cleans frames, conduits, clusters, and registries","Updates spell and version registries","Shares spells across clusters when allowed","Logs via SafeLogger"]},"dependencies":{"depends_on_files":["src/melder/spellbook/bind/spell_index.py","src/melder/spellbook/existence/existence.py","src/melder/aether/conduit/conduit_cluster.py","src/melder/utilities/interfaces/interfaces.py","src/melder/utilities/general_base/cleanable.py","src/melder/aether/aetheric_frame.py","src/melder/utilities/helpers/init_helpers.py","src/melder/__melder_registration_guard__.py"],"external_imports":["logging","threading","typing","ulid"],"internal_imports":["melder.spellbook.bind.spell_index","melder.spellbook.existence.existence","melder.aether.conduit.conduit_cluster","melder.utilities.interfaces.interfaces","melder.utilities.general_base.cleanable","melder.aether.aetheric_frame","melder.utilities.helpers.init_helpers","melder.__melder_registration_guard__"],"runtime_couplings":["Relies on Cleanable._cleaned semantics for lifecycle safety","Uses SafeLogger from InitHelpers.resolve_safe_logger","Assumes AethericFrame exposes conduits, clusters, and registries","Shares spells only for Existence.unique_per_conduit_cluster"]},"dependents":{"notes":"Central singleton used by spellbook and conduit systems for frame and registry operations.","used_by_dirs":[],"used_by_files":[]},"examples":{"integration_flow":["Instantiate Aether singleton","Ensure a frame exists","Register conduits and clusters","Maintain spell registries and shares"],"usage_snippets":[{"code":"from melder.aether.aether import Aether\naether = Aether()\nframe = aether._ensure_frame(\"default\")\n# internal management calls follow","title":"Create and access the Aether singleton"}]},"lifecycle":{"cleanup":{"has_cleanup":true,"method_names":["cleanup","cleanup_frame","cleanup_aetheric_frames"],"order_constraints":["Clean frames before clearing logger","Reset singleton state after cleanup"]},"construction":"Singleton created lazily; initializes default frame and registries on first init.","ownership":"Owns AethericFrame instances, conduit clusters, and spell registries; manages their cleanup.","threading":{"async":false,"locks":["Aether._lock"],"thread_safe":true}},"public_surface":{"entrypoints":["Aether.cleanup","Aether.cleanup_frame","Aether._reset_singleton_for_tests","Aether._ensure_frame","Aether._bind_configuration","Aether._get_configuration","Aether._register_conduit_cloud","Aether._unregister_conduit_cloud","Aether._get_conduit_cloud","Aether._get_conduit_by_name","Aether._get_conduit_by_id","Aether._add_conduit","Aether._remove_conduit","Aether._create_cluster","Aether._remove_cluster","Aether._add_conduit_to_cluster","Aether._remove_conduit_from_cluster","Aether._share_new_spell_to_clusters","Aether._refresh_cluster_shares_for_conduit","Aether._get_conduit_by_spell_id","Aether._check_for_spell","Aether._add_spells_to_aether","Aether._remove_spells_from_aether","Aether._register_single_spell_index","Aether._remove_single_spell_index","Aether._refresh_version_registry","Aether._get_all_spell_versions","Aether._get_mutation_research","Aether._get_devops_manager","Aether._get_spell_system_states","Aether._get_incident_manager","Aether._get_change_control_manager","Aether._revalidate_dirty_roots","Aether.logger"],"exports":["Aether"],"interfaces":{"abc":[],"datamodels":[],"protocols":["IAether"]}},"role_in_system":{"invariants":["Default frame is owned and managed by Aether","Operations check cleaned state before mutation","Frame registry mutations are lock-guarded"],"layer":"core","non_goals":["No conduit implementation details","No external IO or persistence","No public registration API for non-internal use"],"pitfalls":["Forgetting to refresh version registry after spell changes","Using Aether after cleanup","Assuming logger property returns SafeLogger instead of raw logger"],"responsibilities":["Provide the global singleton for frame management","Maintain conduit, cluster, and spell registries","Coordinate cluster sharing hooks","Expose dev-ops and mutation research accessors"]},"summary":{"detail":"Global singleton that owns AethericFrames, manages conduits and clusters, and maintains spell registries with thread-safe access and cleanup.","one_liner":"Singleton orchestrator for frames, conduits, clusters, and spell registries."},"testing":{"commands":[],"coverage_expectations":["Singleton behavior and cleanup reset","Frame and conduit registry mutations","Cluster share hooks for unique-per-cluster spells"],"fixtures":[],"mocks":[],"test_types":[]}},"computed":{"checksums":{"analyzer_version":null,"code_hash_sha256":null,"ctx_semantic_hash_sha256":null,"template_version":"file_ctx@v1"},"freshness_state":"fresh","staleness_reasons":[]},"identity":{"ctx_path":"src/melder/aether/__aether__.json","language":"python","module":"melder.aether.aether","path":"src/melder/aether/aether.py"},"kind":"file_ctx","schema_version":1}