{"agent":{"behavioral_contract":{"error_model":{"logging":"None; raises on invalid construction inputs.","raises":["ValueError when neither spell nor spellframe is provided"],"retryable":[]},"inputs":["spell: Any | None","spellframe: Any | None","binding_name: str | None","spell_override: dict | list | tuple | None"],"outputs":["SpellMap","canonical_key: tuple[str, str]"],"side_effects":["Normalizes binding_name and stores override payload"]},"dependencies":{"depends_on_files":["src/melder/utilities/general_base/cleanable.py","src/melder/utilities/helpers/general_helpers.py","src/melder/__melder_registration_guard__.py"],"external_imports":["typing"],"internal_imports":["melder.utilities.general_base.cleanable","melder.utilities.helpers.general_helpers","melder.__melder_registration_guard__"],"runtime_couplings":["Uses SpellInputUtils normalization for keys"]},"dependents":{"notes":"Used as declarative DI placeholders in spell constructors.","used_by_dirs":["src/melder/**"],"used_by_files":[]},"examples":{"integration_flow":["Declare a DI placeholder for a spell dependency"],"usage_snippets":[{"code":"dep = SpellMap(IService, binding_name='primary')","title":"Declare a SpellMap dependency"}]},"lifecycle":{"cleanup":{"has_cleanup":true,"method_names":["cleanup"],"order_constraints":[]},"construction":"Stores spell/frame/binding metadata and override payload.","ownership":"Owns intent metadata for a DI placeholder.","threading":{"async":false,"locks":[],"thread_safe":true}},"public_surface":{"entrypoints":["SpellMap.lookup_triplet","SpellMap.canonical_key","SpellMap.cleanup"],"exports":["SpellMap"],"interfaces":{"abc":[],"datamodels":[],"protocols":[]}},"role_in_system":{"invariants":["Represents a declarative DI placeholder"],"layer":"core","non_goals":["No resolution logic"],"pitfalls":["Passing None for both spell and spellframe"],"responsibilities":["Describe DI intent","Provide canonical keys for spell lookup"]},"summary":{"detail":"Declarative DI placeholder that encodes spell/frame/binding identity and optional overrides for resolution.","one_liner":"Declares a DI placeholder for spell resolution."},"testing":{"commands":[],"coverage_expectations":["Binding name normalization","cleanup clears references"],"fixtures":[],"mocks":[],"test_types":[]}},"computed":{"checksums":{"analyzer_version":null,"code_hash_sha256":null,"ctx_semantic_hash_sha256":null,"template_version":"file_ctx@v1"},"freshness_state":"fresh","staleness_reasons":[]},"identity":{"ctx_path":"src/melder/aether/conduit/meld/contracts/__spell_map__.json","language":"python","module":"melder.aether.conduit.meld.contracts.spell_map","path":"src/melder/aether/conduit/meld/contracts/spell_map.py"},"kind":"file_ctx","schema_version":1}