{"agent":{"behavioral_contract":{"error_model":{"logging":"None; enum values are static.","raises":[],"retryable":[]},"inputs":[],"outputs":["DetailReason"],"side_effects":[]},"dependencies":{"depends_on_files":["src/melder/__melder_registration_guard__.py"],"external_imports":["enum"],"internal_imports":["melder.__melder_registration_guard__"],"runtime_couplings":[]},"dependents":{"notes":"Used in contract detail entries to label why a spell was contracted.","used_by_dirs":["src/melder/aether/conduit/conduit_ward/**"],"used_by_files":[]},"examples":{"integration_flow":["Assign a reason when creating contract details"],"usage_snippets":[{"code":"reason = DetailReason.root","title":"Choose a contract detail reason"}]},"lifecycle":{"cleanup":{"has_cleanup":false,"method_names":[],"order_constraints":[]},"construction":"Enum values are declared at import time.","ownership":"Owns only enum members.","threading":{"async":false,"locks":[],"thread_safe":true}},"public_surface":{"entrypoints":["DetailReason.root","DetailReason.dependency","DetailReason.manual","DetailReason.other"],"exports":["DetailReason"],"interfaces":{"abc":[],"datamodels":[],"protocols":[]}},"role_in_system":{"invariants":["Enum values are stable"],"layer":"core","non_goals":["No runtime logic"],"pitfalls":["Using the wrong reason when linking dependencies"],"responsibilities":["Classify why a contract detail exists"]},"summary":{"detail":"Enum describing why a contract detail exists (root, dependency, manual, other).","one_liner":"Reason codes for contract details."},"testing":{"commands":[],"coverage_expectations":[],"fixtures":[],"mocks":[],"test_types":[]}},"computed":{"checksums":{"analyzer_version":null,"code_hash_sha256":null,"ctx_semantic_hash_sha256":null,"template_version":"file_ctx@v1"},"freshness_state":"fresh","staleness_reasons":[]},"identity":{"ctx_path":"src/melder/aether/conduit/conduit_ward/contract/__detail_reason__.json","language":"python","module":"melder.aether.conduit.conduit_ward.contract.detail_reason","path":"src/melder/aether/conduit/conduit_ward/contract/detail_reason.py"},"kind":"file_ctx","schema_version":1}